{
  "$defs": {
    "font_spec": {
      "additionalProperties": false,
      "properties": {
        "bold": {
          "description": "Whether this preset renders bold.",
          "type": "boolean"
        },
        "size": {
          "description": "Point size passed to pygame.font.SysFont.",
          "maximum": 72,
          "minimum": 4,
          "type": "integer"
        }
      },
      "required": [
        "bold",
        "size"
      ],
      "type": "object"
    }
  },
  "$id": "fonts.schema.json",
  "$schema": "https://json-schema.org/draft/2020-12/schema",
  "additionalProperties": false,
  "description": "data/ui/fonts.json (UH-6, D5): the 7 font presets engine/render/fonts.py's _FONT_SPECS ships, as schema-checked committed data. Loaded once at boot (game/main.py) and passed to engine.render.fonts.configure_fonts, which rebinds the font cache's point size/bold pair per key; the unconfigured module defaults equal this file's stock content (tools/tests/test_theme_data.py pins it). Font size changes drawn glyphs only — the pinned layout_h table (engine/render/fonts.py) never reads this file, so stored layout rects are unaffected and text can overflow its widget if enlarged (the Theme panel says so). All 7 keys are required: the game names them by key, so a missing one would silently break a screen. Adding a NEW preset key is a schema change, deliberately out of scope for v1 (the fixed set).",
  "properties": {
    "hud_lvl": {
      "$ref": "#/$defs/font_spec",
      "description": "HUD village-level readout."
    },
    "hud_phase": {
      "$ref": "#/$defs/font_spec",
      "description": "HUD phase-banner readout, bottom-left of the game screen."
    },
    "lg": {
      "$ref": "#/$defs/font_spec",
      "description": "Large UI text size (bold) — headings, button labels, panel titles."
    },
    "md": {
      "$ref": "#/$defs/font_spec",
      "description": "Default/medium UI text size — most labels, buttons and readouts."
    },
    "sm": {
      "$ref": "#/$defs/font_spec",
      "description": "Smallest UI text size — dense labels, wrapped body text, footer notes."
    },
    "xl": {
      "$ref": "#/$defs/font_spec",
      "description": "Extra-large UI text size (bold) — screen titles."
    },
    "xxl": {
      "$ref": "#/$defs/font_spec",
      "description": "Largest UI text size (bold) — the main menu title / big banners."
    }
  },
  "required": [
    "hud_lvl",
    "hud_phase",
    "lg",
    "md",
    "sm",
    "xl",
    "xxl"
  ],
  "title": "fonts",
  "type": "object"
}
